{
  "$schema": "http://json-schema.org/draft-07/schema#",
  "title": "FrinkLoop design-system tokens.json",
  "type": "object",
  "required": ["schema_version", "name", "color", "spacing", "typography", "radii"],
  "additionalProperties": true,
  "properties": {
    "schema_version": { "type": "integer", "const": 1 },
    "name": { "type": "string", "minLength": 1 },
    "description": { "type": "string" },
    "color": {
      "type": "object",
      "required": ["fg", "bg", "accent"],
      "properties": {
        "fg": { "type": "string" },
        "bg": { "type": "string" },
        "accent": { "type": "string" },
        "muted": { "type": "string" },
        "border": { "type": "string" }
      },
      "additionalProperties": true
    },
    "spacing": { "type": "object", "additionalProperties": { "type": "string" } },
    "typography": {
      "type": "object",
      "required": ["fontFamily"],
      "properties": {
        "fontFamily": { "type": "string" },
        "weights": { "type": "array", "items": { "type": "integer" } },
        "scale": { "type": "object" }
      },
      "additionalProperties": true
    },
    "radii": { "type": "object", "additionalProperties": { "type": "string" } },
    "shadows": { "type": "object", "additionalProperties": { "type": "string" } }
  }
}
