{
  "schema_version": 1,
  "name": "claude-default",
  "description": "Anthropic Claude.ai-inspired aesthetic — tasteful, monochrome-leaning, generous spacing, restrained accents.",
  "color": {
    "fg": "#1a1a1a",
    "bg": "#fafaf9",
    "accent": "#cc7857",
    "muted": "#737373",
    "border": "#e5e5e5"
  },
  "spacing": {
    "xs": "4px",
    "sm": "8px",
    "md": "16px",
    "lg": "24px",
    "xl": "40px",
    "2xl": "64px"
  },
  "typography": {
    "fontFamily": "ui-serif, Georgia, 'Iowan Old Style', Cambria, 'Times New Roman', Times, serif",
    "weights": [400, 500, 600],
    "scale": {
      "xs": "0.75rem",
      "sm": "0.875rem",
      "base": "1rem",
      "lg": "1.125rem",
      "xl": "1.25rem",
      "2xl": "1.5rem",
      "3xl": "1.875rem",
      "4xl": "2.25rem"
    }
  },
  "radii": {
    "none": "0",
    "sm": "4px",
    "md": "8px",
    "lg": "12px",
    "full": "9999px"
  },
  "shadows": {
    "sm": "0 1px 2px rgba(0,0,0,0.04)",
    "md": "0 4px 12px rgba(0,0,0,0.06)",
    "lg": "0 12px 32px rgba(0,0,0,0.08)"
  }
}
